{
  "contract_type": "speckit.implement.handoff.v2",
  "shard_id": "S03-documentation-01",
  "agent_topology": {
    "core_agent": { "role": "orchestrator" },
    "vertical_planner_agent": {
      "role": "planner",
      "vertical_planner_only": true,
      "may_execute_implementation": false,
      "may_write_manifest": false,
      "may_update_tasks_md": false
    },
    "worker_agent": {
      "role": "executor",
      "single_handoff_only": true,
      "may_dispatch_workers": false,
      "may_update_tasks_md": false
    }
  },
  "lifecycle_stage": "worker_execution",
  "vertical_capability": "documentation",
  "capability_boundary": {
    "owns": [
      "apps/docs/src/content/docs/getting-started/index.mdx",
      "apps/docs/src/content/docs/foundations/index.mdx",
      "apps/docs/src/content/docs/for-agents/index.mdx",
      "apps/docs/src/content/docs/roadmap/index.mdx"
    ],
    "depends_on": [
      "S01-documentation-01 (workspace scaffolding: package.json with deps)"
    ],
    "must_not_touch": [
      "packages/styles/src/",
      "packages/styles/dist/",
      "packages/styles/*",
      "specs/002-docs-poc/tasks.md",
      "apps/docs/package.json",
      "apps/docs/tsconfig.json",
      "apps/docs/astro.config.mjs"
    ]
  },
  "planner_outputs": {
    "shard_plan_path": "handoffs/implement/run-002/planner-outputs/planner-documentation-01/shard-plan.md",
    "handoff_draft_path": "handoffs/implement/run-002/planner-outputs/planner-documentation-01/handoff-draft.json",
    "context_digest_draft_path": "handoffs/implement/run-002/planner-outputs/planner-documentation-01/context-digest-draft.md",
    "vertical_capability": "documentation"
  },
  "draft_source": {
    "vertical_planner_id": "planner-documentation-01",
    "handoff_draft_path": "handoffs/implement/run-002/planner-outputs/planner-documentation-01/handoff-draft.json",
    "context_digest_draft_path": "handoffs/implement/run-002/planner-outputs/planner-documentation-01/context-digest-draft.md"
  },
  "task_ids": ["T009", "T010", "T011", "T012"],
  "task_type": "implementation",
  "task_text": [
    "- [ ] T009 [P] [US2] Create Getting Started page at `apps/docs/src/content/docs/getting-started/index.mdx` with brief instructions on adding `@pathable/styles` from GitHub (e.g. `\"@pathable/styles\": \"github:PathableAI-org/styles\"` in package.json) and local workspace consumption via `workspace:*`",
    "- [ ] T010 [P] [US2] Create Foundations page at `apps/docs/src/content/docs/foundations/index.mdx` briefly describing the style foundations available: brand colors, typography (font families, scale), spacing scale, elevation levels, and border-radius tokens",
    "- [ ] T011 [P] [US2] Create For Agents page at `apps/docs/src/content/docs/for-agents/index.mdx` explaining the agent-facing rules and how AI agents should consume the styles package (reference AGENTS.md and BRAND_RULES.md)",
    "- [ ] T012 [P] [US2] Create Roadmap page at `apps/docs/src/content/docs/roadmap/index.mdx` listing future plans: HTML/CSS examples, React examples, Vue examples, component catalog, npm publishing"
  ],
  "context_digest_path": "handoffs/implement/run-002/S03-documentation-01/context-digest.md",
  "context_index_path": "specs/002-docs-poc/context-index.json",
  "allowed_read_paths": [
    "specs/002-docs-poc/spec.md",
    "specs/002-docs-poc/plan.md",
    "specs/002-docs-poc/context-index.json",
    "packages/styles/AGENTS.md",
    "packages/styles/BRAND_RULES.md",
    "packages/styles/dist/styles.css"
  ],
  "allowed_write_paths": [
    "apps/docs/src/content/docs/getting-started/index.mdx",
    "apps/docs/src/content/docs/foundations/index.mdx",
    "apps/docs/src/content/docs/for-agents/index.mdx",
    "apps/docs/src/content/docs/roadmap/index.mdx",
    "handoffs/implement/run-002/S03-documentation-01/results"
  ],
  "context_gaps": [],
  "validation_commands": [
    "test -f apps/docs/src/content/docs/getting-started/index.mdx && echo 'getting-started exists'",
    "test -f apps/docs/src/content/docs/foundations/index.mdx && echo 'foundations exists'",
    "test -f apps/docs/src/content/docs/for-agents/index.mdx && echo 'for-agents exists'",
    "test -f apps/docs/src/content/docs/roadmap/index.mdx && echo 'roadmap exists'",
    "pnpm --filter @pathable/docs build"
  ],
  "task_status_update": {
    "mode": "receipt",
    "receipt_path": "handoffs/implement/run-002/S03-documentation-01/results/receipt.json",
    "committer": "core_agent",
    "contract_type": "speckit.implement.receipt.v1",
    "required_fields": [
      "contract_type",
      "shard_id",
      "task_type",
      "task_ids",
      "completed_task_ids",
      "changed_paths",
      "validation_evidence"
    ]
  },
  "forbidden_actions": [
    "edit tasks.md",
    "edit packages/styles/",
    "edit apps/docs/package.json",
    "edit apps/docs/tsconfig.json",
    "edit apps/docs/astro.config.mjs",
    "dispatch workers",
    "edit handoff-manifest.json"
  ]
}