{
  "contract_type": "speckit.implement.handoff.v2",
  "shard_id": "S07-cleanup-01",
  "agent_topology": {
    "core_agent": { "role": "orchestrator" },
    "vertical_planner_agent": { "role": "planner", "vertical_planner_only": true, "may_execute_implementation": false, "may_write_manifest": false, "may_update_tasks_md": false },
    "worker_agent": { "role": "executor", "single_handoff_only": true, "may_dispatch_workers": false, "may_update_tasks_md": false }
  },
  "lifecycle_stage": "polish",
  "vertical_capability": "cleanup",
  "capability_boundary": {
    "owns": [
      "packages/styles/dist/styles.css",
      "packages/styles/"
    ],
    "depends_on": ["S04-integration-04", "S05-integration-05", "S06-documentation-01"],
    "must_not_touch": []
  },
  "planner_outputs": {
    "shard_plan_path": "handoffs/implement/run-003/planner-outputs/planner-cleanup-01/shard-plan.md",
    "handoff_draft_path": "handoffs/implement/run-003/planner-outputs/planner-cleanup-01/handoff-draft.json",
    "context_digest_draft_path": "handoffs/implement/run-003/planner-outputs/planner-cleanup-01/context-digest-draft.md",
    "vertical_capability": "cleanup"
  },
  "draft_source": {
    "vertical_planner_id": "planner-cleanup-01",
    "handoff_draft_path": "handoffs/implement/run-003/planner-outputs/planner-cleanup-01/handoff-draft.json",
    "context_digest_draft_path": "handoffs/implement/run-003/planner-outputs/planner-cleanup-01/context-digest-draft.md"
  },
  "task_ids": ["T042", "T043", "T044"],
  "task_type": "implementation",
  "task_text": [
    "T042: Build and verify final dist/styles.css — confirm all existing --pathable-* CSS custom properties are present, all $theme-color-* tokens are configured, and no .usa- component styles leaked in",
    "T043: Run pnpm pack --dry-run in packages/styles/ to verify published package contents are correct (should include dist/, src/, README, BRAND_RULES, AGENTS)",
    "T044: Commit all changes with a descriptive message"
  ],
  "context_digest_path": "handoffs/implement/run-003/S07-cleanup-01/context-digest.md",
  "context_index_path": "specs/003-wrap-uswds-theme/context-index.json",
  "allowed_read_paths": [
    "packages/styles/dist/styles.css",
    "packages/styles/src/",
    "packages/styles/package.json",
    "packages/styles/README.md",
    "packages/styles/BRAND_RULES.md",
    "packages/styles/AGENTS.md",
    "specs/003-wrap-uswds-theme/context-index.json"
  ],
  "allowed_write_paths": [],
  "context_gaps": [],
  "validation_commands": [
    "cd packages/styles && pnpm build 2>&1 && echo 'BUILD_OK'",
    "grep -c '--pathable-blue' packages/styles/dist/styles.css | xargs echo 'pathable-blue-count:'",
    "grep -c '.usa-' packages/styles/dist/styles.css | xargs echo 'usa-class-count:'",
    "cd packages/styles && pnpm pack --dry-run 2>&1"
  ],
  "task_status_update": {
    "mode": "receipt",
    "receipt_path": "handoffs/implement/run-003/S07-cleanup-01/results/receipt.json",
    "committer": "core_agent",
    "contract_type": "speckit.implement.receipt.v1",
    "required_fields": ["contract_type", "shard_id", "task_type", "task_ids", "completed_task_ids", "changed_paths", "validation_evidence"]
  },
  "forbidden_actions": [
    "edit tasks.md",
    "edit src/",
    "edit package.json",
    "edit README.md",
    "edit BRAND_RULES.md",
    "edit AGENTS.md",
    "dispatch workers"
  ]
}