{
  "contract_type": "speckit.implement.handoff.v2",
  "shard_id": "S01-documentation-01",
  "agent_topology": {
    "core_agent": { "role": "orchestrator" },
    "vertical_planner_agent": {
      "role": "planner",
      "vertical_planner_only": true,
      "may_execute_implementation": false,
      "may_write_manifest": false,
      "may_update_tasks_md": false
    },
    "worker_agent": {
      "role": "executor",
      "single_handoff_only": true,
      "may_dispatch_workers": false,
      "may_update_tasks_md": false
    }
  },
  "lifecycle_stage": "worker_execution",
  "vertical_capability": "documentation",
  "capability_boundary": {
    "owns": [
      "packages/styles/README.md",
      "packages/styles/BRAND_RULES.md",
      "packages/styles/AGENTS.md",
      "packages/styles/.stylelintrc.json"
    ],
    "depends_on": [],
    "must_not_touch": ["packages/styles/src/", "packages/styles/dist/"]
  },
  "planner_outputs": {
    "shard_plan_path": "handoffs/implement/run-001/planner-outputs/planner-documentation-01/shard-plan.md",
    "handoff_draft_path": "handoffs/implement/run-001/planner-outputs/planner-documentation-01/handoff-draft.json",
    "context_digest_draft_path": "handoffs/implement/run-001/planner-outputs/planner-documentation-01/context-digest-draft.md",
    "vertical_capability": "documentation"
  },
  "draft_source": {
    "vertical_planner_id": "planner-documentation-01",
    "handoff_draft_path": "handoffs/implement/run-001/planner-outputs/planner-documentation-01/handoff-draft.json",
    "context_digest_draft_path": "handoffs/implement/run-001/planner-outputs/planner-documentation-01/context-digest-draft.md"
  },
  "task_ids": ["T002", "T003", "T004"],
  "task_type": "implementation",
  "task_text": [
    "- [ ] T002 Add \"files\" field to `packages/styles/package.json` to include `README.md`, `BRAND_RULES.md`, `AGENTS.md`, `dist/`, and `src/` in the published package",
    "- [ ] T003 [P] Fix markdown formatting issues in `packages/styles/README.md`: close unclosed code block delimiter after the Usage code block, format \"Guidance\", \"Accessibility\", and \"License\" as proper section headings",
    "- [ ] T004 [P] Create `.stylelintrc.json` at `packages/styles/` with SCSS linting rules configured for `stylelint ^16.18.0`"
  ],
  "context_digest_path": "handoffs/implement/run-001/S01-documentation-01/context-digest.md",
  "context_index_path": "specs/001-brand-design-tokens/context-index.json",
  "allowed_read_paths": [
    "packages/styles/package.json",
    "packages/styles/README.md",
    "specs/001-brand-design-tokens/context-index.json",
    "specs/001-brand-design-tokens/research.md",
    "specs/001-brand-design-tokens/quickstart.md"
  ],
  "allowed_write_paths": [
    "packages/styles/package.json",
    "packages/styles/README.md",
    "packages/styles/.stylelintrc.json",
    "handoffs/implement/run-001/S01-documentation-01/results"
  ],
  "context_gaps": [],
  "validation_commands": [
    "cd packages/styles && pnpm build",
    "cd packages/styles && pnpm pack --dry-run"
  ],
  "task_status_update": {
    "mode": "receipt",
    "receipt_path": "handoffs/implement/run-001/S01-documentation-01/results/receipt.json",
    "committer": "core_agent",
    "contract_type": "speckit.implement.receipt.v1",
    "required_fields": [
      "contract_type",
      "shard_id",
      "task_type",
      "task_ids",
      "completed_task_ids",
      "changed_paths",
      "validation_evidence"
    ]
  },
  "forbidden_actions": [
    "edit tasks.md",
    "edit packages/styles/src/",
    "edit packages/styles/dist/",
    "dispatch workers"
  ]
}
