{
  "contract_type": "speckit.implement.handoff.v2",
  "shard_id": "S01-documentation-01",
  "agent_topology": {
    "core_agent": { "role": "orchestrator" },
    "vertical_planner_agent": {
      "role": "planner",
      "vertical_planner_only": true,
      "may_execute_implementation": false,
      "may_write_manifest": false,
      "may_update_tasks_md": false
    },
    "worker_agent": {
      "role": "executor",
      "single_handoff_only": true,
      "may_dispatch_workers": false,
      "may_update_tasks_md": false
    }
  },
  "lifecycle_stage": "worker_execution",
  "vertical_capability": "documentation",
  "capability_boundary": {
    "owns": [
      "pnpm-workspace.yaml",
      "apps/docs/package.json",
      "apps/docs/tsconfig.json"
    ],
    "depends_on": [],
    "must_not_touch": [
      "packages/styles/src/",
      "packages/styles/dist/",
      "packages/styles/package.json",
      "packages/styles/README.md",
      "packages/styles/BRAND_RULES.md",
      "packages/styles/AGENTS.md",
      "specs/002-docs-poc/tasks.md"
    ]
  },
  "planner_outputs": {
    "shard_plan_path": "handoffs/implement/run-002/planner-outputs/planner-documentation-01/shard-plan.md",
    "handoff_draft_path": "handoffs/implement/run-002/planner-outputs/planner-documentation-01/handoff-draft.json",
    "context_digest_draft_path": "handoffs/implement/run-002/planner-outputs/planner-documentation-01/context-digest-draft.md",
    "vertical_capability": "documentation"
  },
  "draft_source": {
    "vertical_planner_id": "planner-documentation-01",
    "handoff_draft_path": "handoffs/implement/run-002/planner-outputs/planner-documentation-01/handoff-draft.json",
    "context_digest_draft_path": "handoffs/implement/run-002/planner-outputs/planner-documentation-01/context-digest-draft.md"
  },
  "task_ids": ["T001", "T002", "T003"],
  "task_type": "implementation",
  "task_text": [
    "- [ ] T001 Update `pnpm-workspace.yaml` at repo root to include `\"apps/*\"` alongside existing `\"packages/*\"`",
    "- [ ] T002 Create `apps/docs/package.json` with name `@pathable/docs`, `\"private\": true`, deps on `astro`, `@astrojs/starlight`, `\"@pathable/styles\": \"workspace:*\"`",
    "- [ ] T003 [P] Create `apps/docs/tsconfig.json` with Astro-compatible TypeScript config (extends `astro/tsconfigs/strict`)"
  ],
  "context_digest_path": "handoffs/implement/run-002/S01-documentation-01/context-digest.md",
  "context_index_path": "specs/002-docs-poc/context-index.json",
  "allowed_read_paths": [
    "pnpm-workspace.yaml",
    "package.json",
    "specs/002-docs-poc/plan.md",
    "specs/002-docs-poc/context-index.json",
    "specs/002-docs-poc/quickstart.md",
    "specs/002-docs-poc/spec.md"
  ],
  "allowed_write_paths": [
    "pnpm-workspace.yaml",
    "apps/docs/package.json",
    "apps/docs/tsconfig.json",
    "handoffs/implement/run-002/S01-documentation-01/results"
  ],
  "context_gaps": [],
  "validation_commands": [
    "cat pnpm-workspace.yaml | grep \"apps/*\"",
    "node -e \"const p = require('./apps/docs/package.json'); console.log(p.name, p.private, Object.keys(p.dependencies || {}))\"",
    "test -f apps/docs/tsconfig.json && echo 'tsconfig exists'"
  ],
  "task_status_update": {
    "mode": "receipt",
    "receipt_path": "handoffs/implement/run-002/S01-documentation-01/results/receipt.json",
    "committer": "core_agent",
    "contract_type": "speckit.implement.receipt.v1",
    "required_fields": [
      "contract_type",
      "shard_id",
      "task_type",
      "task_ids",
      "completed_task_ids",
      "changed_paths",
      "validation_evidence"
    ]
  },
  "forbidden_actions": [
    "edit tasks.md",
    "edit packages/styles/src/",
    "edit packages/styles/dist/",
    "edit packages/styles/package.json",
    "edit packages/styles/README.md",
    "edit packages/styles/BRAND_RULES.md",
    "edit packages/styles/AGENTS.md",
    "dispatch workers",
    "edit handoff-manifest.json"
  ]
}