{
  "contract_type": "speckit.implement.handoff.v2",
  "shard_id": "S04-integration-01",
  "agent_topology": {
    "core_agent": { "role": "orchestrator" },
    "vertical_planner_agent": {
      "role": "planner",
      "vertical_planner_only": true,
      "may_execute_implementation": false,
      "may_write_manifest": false,
      "may_update_tasks_md": false
    },
    "worker_agent": {
      "role": "executor",
      "single_handoff_only": true,
      "may_dispatch_workers": false,
      "may_update_tasks_md": false
    }
  },
  "lifecycle_stage": "worker_execution",
  "vertical_capability": "integration",
  "capability_boundary": {
    "owns": [
      ".github/workflows/docs-ci.yml",
      ".github/workflows/docs-deploy.yml"
    ],
    "depends_on": [
      "Documentation shards (S01-S03) - workspace must be registered before workflows reference it"
    ],
    "must_not_touch": [
      "packages/styles/src/**",
      "packages/styles/dist/**",
      "packages/styles/package.json",
      "packages/styles/README.md",
      "packages/styles/BRAND_RULES.md",
      "packages/styles/AGENTS.md",
      "apps/docs/",
      "pnpm-workspace.yaml"
    ]
  },
  "planner_outputs": {
    "shard_plan_path": "handoffs/implement/run-002/planner-outputs/planner-integration-01/shard-plan.md",
    "handoff_draft_path": "handoffs/implement/run-002/planner-outputs/planner-integration-01/handoff-draft.json",
    "context_digest_draft_path": "handoffs/implement/run-002/planner-outputs/planner-integration-01/context-digest-draft.md",
    "vertical_capability": "integration"
  },
  "draft_source": {
    "vertical_planner_id": "planner-integration-01",
    "handoff_draft_path": "handoffs/implement/run-002/planner-outputs/planner-integration-01/handoff-draft.json",
    "context_digest_draft_path": "handoffs/implement/run-002/planner-outputs/planner-integration-01/context-digest-draft.md"
  },
  "task_ids": ["T013", "T014"],
  "task_type": "implementation",
  "task_text": [
    "- [ ] T013 Create `.github/workflows/docs-ci.yml` with trigger on `pull_request`, steps: checkout, pnpm/action-setup, actions/setup-node, pnpm install, pnpm --filter @pathable/styles build, pnpm --filter @pathable/docs build. No deploy step.",
    "- [ ] T014 Create `.github/workflows/docs-deploy.yml` with trigger on `push` to `main`, permissions `contents: read`, `pages: write`, `id-token: write`, environment `github-pages`. Steps: checkout, pnpm/action-setup, actions/setup-node, pnpm install, pnpm --filter @pathable/styles build, pnpm --filter @pathable/docs build, actions/configure-pages, actions/upload-pages-artifact (path: apps/docs/dist), actions/deploy-pages."
  ],
  "context_digest_path": "handoffs/implement/run-002/S04-integration-01/context-digest.md",
  "context_index_path": "specs/002-docs-poc/context-index.json",
  "allowed_read_paths": [
    "specs/002-docs-poc/spec.md",
    "specs/002-docs-poc/plan.md",
    "specs/002-docs-poc/quickstart.md",
    "specs/002-docs-poc/context-index.json",
    "specs/002-docs-poc/data-model.md",
    "package.json",
    ".github/workflows/"
  ],
  "allowed_write_paths": [
    ".github/workflows/docs-ci.yml",
    ".github/workflows/docs-deploy.yml",
    "handoffs/implement/run-002/S04-integration-01/results"
  ],
  "context_gaps": [],
  "validation_commands": [
    "test -f .github/workflows/docs-ci.yml && echo 'CI workflow exists'",
    "test -f .github/workflows/docs-deploy.yml && echo 'deploy workflow exists'",
    "grep -q 'pull_request' .github/workflows/docs-ci.yml && echo 'PR trigger configured'",
    "grep -q 'deploy-pages' .github/workflows/docs-deploy.yml && echo 'deploy step configured'"
  ],
  "task_status_update": {
    "mode": "receipt",
    "receipt_path": "handoffs/implement/run-002/S04-integration-01/results/receipt.json",
    "committer": "core_agent",
    "contract_type": "speckit.implement.receipt.v1",
    "required_fields": [
      "contract_type",
      "shard_id",
      "task_type",
      "task_ids",
      "completed_task_ids",
      "changed_paths",
      "validation_evidence"
    ]
  },
  "forbidden_actions": [
    "edit tasks.md",
    "edit packages/styles/",
    "edit apps/docs/",
    "edit pnpm-workspace.yaml",
    "dispatch workers",
    "write handoff-manifest.json",
    "deploy to GitHub Pages",
    "add React, Vue, Storybook, Tailwind, or Playwright dependencies"
  ]
}