{
  "contract_type": "speckit.implement.handoff.v2",
  "shard_id": "S04-documentation-01",
  "agent_topology": {
    "core_agent": { "role": "orchestrator" },
    "vertical_planner_agent": {
      "role": "planner", "vertical_planner_only": true,
      "may_execute_implementation": false, "may_write_manifest": false, "may_update_tasks_md": false
    },
    "worker_agent": {
      "role": "executor", "single_handoff_only": true,
      "may_dispatch_workers": false, "may_update_tasks_md": false
    }
  },
  "lifecycle_stage": "us1_components",
  "vertical_capability": "documentation",
  "capability_boundary": {
    "owns": ["packages/styles/src/stories/components/FormControls/", "packages/styles/src/stories/components/Layout/"],
    "depends_on": ["S02-documentation-01"],
    "must_not_touch": ["packages/styles/src/ (SCSS)", ".storybook/", "tasks.md"]
  },
  "planner_outputs": {
    "shard_plan_path": "handoffs/implement/008-implement-001/planner-outputs/documentation-shard-plan.md",
    "handoff_draft_path": "handoffs/implement/008-implement-001/planner-outputs/documentation-handoff-draft.json",
    "context_digest_draft_path": "handoffs/implement/008-implement-001/planner-outputs/documentation-context-digest-draft.md",
    "vertical_capability": "documentation"
  },
  "draft_source": {
    "vertical_planner_id": "planner-documentation-01",
    "handoff_draft_path": "handoffs/implement/008-implement-001/planner-outputs/documentation-handoff-draft.json",
    "context_digest_draft_path": "handoffs/implement/008-implement-001/planner-outputs/documentation-context-digest-draft.md"
  },
  "task_ids": ["T015", "T016", "T017", "T018", "T019", "T020", "T021", "T022", "T037", "T038"],
  "task_type": "implementation",
  "task_text": [
    "T015: Create packages/styles/src/stories/components/FormControls/Checkbox.stories.js with Default Checkbox and Tile checkbox variants",
    "T016: Create packages/styles/src/stories/components/FormControls/ComboBox.stories.js with JS-driven note and static HTML example",
    "T017: Create packages/styles/src/stories/components/FormControls/DatePicker.stories.js with JS-driven note and static HTML example",
    "T018: Create packages/styles/src/stories/components/FormControls/DateRangePicker.stories.js with JS-driven note and static HTML example",
    "T019: Create packages/styles/src/stories/components/FormControls/Input.stories.js with Text, Password, Email, and Search input variants",
    "T020: Create packages/styles/src/stories/components/FormControls/Radio.stories.js with Default Radio and Tile radio variants",
    "T021: Create packages/styles/src/stories/components/FormControls/Select.stories.js with Default and multiple-select option variants",
    "T022: Create packages/styles/src/stories/components/FormControls/Textarea.stories.js with Default and textarea in form context",
    "T037: Create packages/styles/src/stories/components/Layout/Icon.stories.js with example icon grid showing pathable-icon usage",
    "T038: Create packages/styles/src/stories/components/Layout/MediaBlock.stories.js with Default media block layout example"
  ],
  "context_digest_path": "handoffs/implement/008-implement-001/S04-documentation-01/context-digest.md",
  "context_index_path": "context-index.json",
  "allowed_read_paths": ["context-index.json", "specs/008-storybook-documentation/contracts/story-interface.md"],
  "allowed_write_paths": [
    "packages/styles/src/stories/components/FormControls/Checkbox.stories.js",
    "packages/styles/src/stories/components/FormControls/ComboBox.stories.js",
    "packages/styles/src/stories/components/FormControls/DatePicker.stories.js",
    "packages/styles/src/stories/components/FormControls/DateRangePicker.stories.js",
    "packages/styles/src/stories/components/FormControls/Input.stories.js",
    "packages/styles/src/stories/components/FormControls/Radio.stories.js",
    "packages/styles/src/stories/components/FormControls/Select.stories.js",
    "packages/styles/src/stories/components/FormControls/Textarea.stories.js",
    "packages/styles/src/stories/components/Layout/Icon.stories.js",
    "packages/styles/src/stories/components/Layout/MediaBlock.stories.js",
    "handoffs/implement/008-implement-001/S04-documentation-01/results/"
  ],
  "context_gaps": [],
  "validation_commands": [
    "test -f packages/styles/src/stories/components/FormControls/Checkbox.stories.js",
    "test -f packages/styles/src/stories/components/Layout/Icon.stories.js",
    "grep -q 'USWDS JavaScript' packages/styles/src/stories/components/FormControls/ComboBox.stories.js",
    "grep -q 'USWDS JavaScript' packages/styles/src/stories/components/FormControls/DatePicker.stories.js",
    "grep -q 'USWDS JavaScript' packages/styles/src/stories/components/FormControls/DateRangePicker.stories.js"
  ],
  "task_status_update": {
    "mode": "receipt",
    "receipt_path": "handoffs/implement/008-implement-001/S04-documentation-01/results/receipt.json",
    "committer": "core_agent",
    "contract_type": "speckit.implement.receipt.v1",
    "required_fields": ["contract_type", "shard_id", "task_ids", "completed_task_ids", "changed_paths", "validation_evidence"]
  },
  "forbidden_actions": ["edit tasks.md", "edit SCSS source files", "edit .storybook/ config files", "dispatch workers"]
}