{
  "contract_type": "speckit.implement.handoff.v2",
  "shard_id": "S02-documentation-01",
  "agent_topology": {
    "core_agent": { "role": "orchestrator" },
    "vertical_planner_agent": {
      "role": "planner",
      "vertical_planner_only": true,
      "may_execute_implementation": false,
      "may_write_manifest": false,
      "may_update_tasks_md": false
    },
    "worker_agent": {
      "role": "executor",
      "single_handoff_only": true,
      "may_dispatch_workers": false,
      "may_update_tasks_md": false
    }
  },
  "lifecycle_stage": "foundational",
  "vertical_capability": "documentation",
  "capability_boundary": {
    "owns": ["packages/styles/.storybook/main.js", "packages/styles/.storybook/preview.js", "package.json storybook scripts"],
    "depends_on": ["S01-documentation-01"],
    "must_not_touch": ["packages/styles/src/", "tasks.md"]
  },
  "planner_outputs": {
    "shard_plan_path": "handoffs/implement/008-implement-001/planner-outputs/documentation-shard-plan.md",
    "handoff_draft_path": "handoffs/implement/008-implement-001/planner-outputs/documentation-handoff-draft.json",
    "context_digest_draft_path": "handoffs/implement/008-implement-001/planner-outputs/documentation-context-digest-draft.md",
    "vertical_capability": "documentation"
  },
  "draft_source": {
    "vertical_planner_id": "planner-documentation-01",
    "handoff_draft_path": "handoffs/implement/008-implement-001/planner-outputs/documentation-handoff-draft.json",
    "context_digest_draft_path": "handoffs/implement/008-implement-001/planner-outputs/documentation-context-digest-draft.md"
  },
  "task_ids": ["T005", "T006", "T007"],
  "task_type": "implementation",
  "task_text": [
    "T005: Create packages/styles/.storybook/main.js with @storybook/html-vite framework, @storybook/addon-docs addon, stories glob '../src/stories/**/*.stories.js', and docs: { autodocs: true }. Do NOT include any test addons (FR-009).",
    "T006: Create packages/styles/.storybook/preview.js with import '../dist/styles.css' and control matchers for color and date types.",
    "T007: Update packages/styles/package.json scripts section to add \"storybook\": \"storybook dev -p 6006\" and \"build-storybook\": \"storybook build\"."
  ],
  "context_digest_path": "handoffs/implement/008-implement-001/S02-documentation-01/context-digest.md",
  "context_index_path": "context-index.json",
  "allowed_read_paths": [
    "packages/styles/package.json",
    "packages/styles/.storybook/",
    "context-index.json"
  ],
  "allowed_write_paths": [
    "packages/styles/.storybook/main.js",
    "packages/styles/.storybook/preview.js",
    "packages/styles/package.json",
    "handoffs/implement/008-implement-001/S02-documentation-01/results/"
  ],
  "context_gaps": [],
  "validation_commands": [
    "test -f packages/styles/.storybook/main.js && grep -q '@storybook/html-vite' packages/styles/.storybook/main.js",
    "test -f packages/styles/.storybook/preview.js && grep -q 'styles.css' packages/styles/.storybook/preview.js",
    "grep -q '\"storybook\"' packages/styles/package.json"
  ],
  "task_status_update": {
    "mode": "receipt",
    "receipt_path": "handoffs/implement/008-implement-001/S02-documentation-01/results/receipt.json",
    "committer": "core_agent",
    "contract_type": "speckit.implement.receipt.v1",
    "required_fields": ["contract_type", "shard_id", "task_ids", "completed_task_ids", "changed_paths", "validation_evidence"]
  },
  "forbidden_actions": [
    "edit tasks.md",
    "edit SCSS source files in packages/styles/src/",
    "add test addons to main.js",
    "dispatch workers"
  ]
}