{
  "contract_type": "speckit.implement.handoff.v2",
  "shard_id": "S01-integration-01",
  "agent_topology": {
    "core_agent": { "role": "orchestrator" },
    "vertical_planner_agent": {
      "role": "planner",
      "vertical_planner_only": true,
      "may_execute_implementation": false,
      "may_write_manifest": false,
      "may_update_tasks_md": false
    },
    "worker_agent": {
      "role": "executor",
      "single_handoff_only": true,
      "may_dispatch_workers": false,
      "may_update_tasks_md": false
    }
  },
  "lifecycle_stage": "worker_execution",
  "vertical_capability": "integration",
  "capability_boundary": {
    "owns": [
      ".github/workflows/docs-ci.yml",
      ".github/workflows/docs-deploy.yml"
    ],
    "depends_on": [
      "Setup capability (T001, T002, T003) — pnpm-workspace.yaml, apps/docs/package.json, apps/docs/tsconfig.json",
      "Foundational capability (T005) — apps/docs/astro.config.mjs",
      "US1/US2 content capability (T007-T012b) — content pages and custom stylesheet"
    ],
    "must_not_touch": [
      "packages/styles/src/**",
      "packages/styles/dist/**",
      "packages/styles/package.json",
      "packages/styles/README.md",
      "packages/styles/BRAND_RULES.md",
      "packages/styles/AGENTS.md"
    ]
  },
  "planner_outputs": {
    "shard_plan_path": "handoffs/implement/run-002/planner-outputs/planner-integration-01/shard-plan.md",
    "handoff_draft_path": "handoffs/implement/run-002/planner-outputs/planner-integration-01/handoff-draft.json",
    "context_digest_draft_path": "handoffs/implement/run-002/planner-outputs/planner-integration-01/context-digest-draft.md",
    "vertical_capability": "integration"
  },
  "draft_source": {
    "vertical_planner_id": "planner-integration-01",
    "handoff_draft_path": "handoffs/implement/run-002/planner-outputs/planner-integration-01/handoff-draft.json",
    "context_digest_draft_path": "handoffs/implement/run-002/planner-outputs/planner-integration-01/context-digest-draft.md"
  },
  "task_ids": ["T004", "T006", "T013", "T014", "T015", "T016"],
  "task_type": "implementation",
  "task_text": [
    "- [ ] T004 Run `pnpm install` from repo root and verify `pnpm-lock.yaml` is updated",
    "- [ ] T006 Run `pnpm build` from repo root and confirm both `packages/styles/dist/styles.css` and `apps/docs/dist/` are produced without errors",
    "- [ ] T013 Create `.github/workflows/docs-ci.yml` with trigger on `pull_request`, steps: checkout, pnpm/action-setup, actions/setup-node, pnpm install, pnpm --filter @pathable/styles build, pnpm --filter @pathable/docs build. No deploy step.",
    "- [ ] T014 Create `.github/workflows/docs-deploy.yml` with trigger on `push` to `main`, permissions `contents: read`, `pages: write`, `id-token: write`, environment `github-pages`. Steps: checkout, pnpm/action-setup, actions/setup-node, pnpm install, pnpm --filter @pathable/styles build, pnpm --filter @pathable/docs build, actions/configure-pages, actions/upload-pages-artifact (path: apps/docs/dist), actions/deploy-pages.",
    "- [ ] T015 Run full build from repo root (`pnpm build`) and confirm zero errors",
    "- [ ] T016 Run quickstart.md validation path: build styles independently, build docs independently, verify nav sections in output, confirm `packages/styles` behavior is unchanged"
  ],
  "context_digest_path": "handoffs/implement/run-002/S01-integration-01/context-digest.md",
  "context_index_path": "specs/002-docs-poc/context-index.json",
  "allowed_read_paths": [
    "specs/002-docs-poc/spec.md",
    "specs/002-docs-poc/plan.md",
    "specs/002-docs-poc/tasks.md",
    "specs/002-docs-poc/quickstart.md",
    "specs/002-docs-poc/context-index.json",
    "specs/002-docs-poc/data-model.md",
    "specs/002-docs-poc/research.md",
    "specs/002-docs-poc/contracts/README.md",
    "pnpm-workspace.yaml",
    "package.json",
    "apps/docs/package.json",
    "apps/docs/astro.config.mjs",
    ".github/workflows/"
  ],
  "allowed_write_paths": [
    ".github/workflows/docs-ci.yml",
    ".github/workflows/docs-deploy.yml"
  ],
  "context_gaps": [],
  "validation_commands": [
    "pnpm install",
    "pnpm build",
    "pnpm --filter @pathable/styles build && ls packages/styles/dist/styles.css",
    "pnpm --filter @pathable/docs build && ls apps/docs/dist/index.html",
    "ls apps/docs/dist/getting-started/index.html",
    "ls apps/docs/dist/foundations/index.html",
    "ls apps/docs/dist/for-agents/index.html",
    "ls apps/docs/dist/roadmap/index.html",
    "git status packages/styles/"
  ],
  "task_status_update": {
    "mode": "receipt",
    "receipt_path": "handoffs/implement/run-002/S01-integration-01/results/receipt.json",
    "committer": "core_agent",
    "contract_type": "speckit.implement.receipt.v1",
    "required_fields": [
      "contract_type",
      "shard_id",
      "task_type",
      "task_ids",
      "completed_task_ids",
      "changed_paths",
      "validation_evidence"
    ]
  },
  "forbidden_actions": [
    "edit tasks.md",
    "edit packages/styles/",
    "dispatch workers",
    "write handoff-manifest.json",
    "deploy to GitHub Pages",
    "add npm publish steps",
    "add React, Vue, Storybook, Tailwind, or Playwright dependencies"
  ]
}