{
  "contract_type": "speckit.implement.handoff.v2",
  "shard_id": "S06-documentation-01",
  "agent_topology": {
    "core_agent": { "role": "orchestrator" },
    "vertical_planner_agent": {
      "role": "planner", "vertical_planner_only": true,
      "may_execute_implementation": false, "may_write_manifest": false, "may_update_tasks_md": false
    },
    "worker_agent": {
      "role": "executor", "single_handoff_only": true,
      "may_dispatch_workers": false, "may_update_tasks_md": false
    }
  },
  "lifecycle_stage": "us1_components",
  "vertical_capability": "documentation",
  "capability_boundary": {
    "owns": ["packages/styles/src/stories/components/Communication/"],
    "depends_on": ["S02-documentation-01"],
    "must_not_touch": ["packages/styles/src/ (SCSS)", ".storybook/", "tasks.md"]
  },
  "planner_outputs": {
    "shard_plan_path": "handoffs/implement/008-implement-001/planner-outputs/documentation-shard-plan.md",
    "handoff_draft_path": "handoffs/implement/008-implement-001/planner-outputs/documentation-handoff-draft.json",
    "context_digest_draft_path": "handoffs/implement/008-implement-001/planner-outputs/documentation-context-digest-draft.md",
    "vertical_capability": "documentation"
  },
  "draft_source": {
    "vertical_planner_id": "planner-documentation-01",
    "handoff_draft_path": "handoffs/implement/008-implement-001/planner-outputs/documentation-handoff-draft.json",
    "context_digest_draft_path": "handoffs/implement/008-implement-001/planner-outputs/documentation-context-digest-draft.md"
  },
  "task_ids": ["T029", "T030", "T031", "T032", "T033", "T034", "T035", "T036"],
  "task_type": "implementation",
  "task_text": [
    "T029: Create packages/styles/src/stories/components/Communication/Accordion.stories.js with JS-driven note and static accordion HTML structure showing border-box variants and sub-elements (heading, button, content)",
    "T030: Create packages/styles/src/stories/components/Communication/Alert.stories.js with Info, Warning, Error, Success, Emergency, and Slim variant stories",
    "T031: Create packages/styles/src/stories/components/Communication/Banner.stories.js with JS-driven note and static banner HTML with sub-elements",
    "T032: Create packages/styles/src/stories/components/Communication/Modal.stories.js with JS-driven note and static modal HTML structure with overlay and dialog sub-elements",
    "T033: Create packages/styles/src/stories/components/Communication/ProcessList.stories.js with Default process list step examples",
    "T034: Create packages/styles/src/stories/components/Communication/SiteAlert.stories.js with JS-driven note and Info, Warning, Emergency, and Slim variants",
    "T035: Create packages/styles/src/stories/components/Communication/StepIndicator.stories.js with Default step indicator example",
    "T036: Create packages/styles/src/stories/components/Communication/SummaryBox.stories.js with Default summary box example"
  ],
  "context_digest_path": "handoffs/implement/008-implement-001/S06-documentation-01/context-digest.md",
  "context_index_path": "context-index.json",
  "allowed_read_paths": ["context-index.json", "specs/008-storybook-documentation/contracts/story-interface.md"],
  "allowed_write_paths": [
    "packages/styles/src/stories/components/Communication/Accordion.stories.js",
    "packages/styles/src/stories/components/Communication/Alert.stories.js",
    "packages/styles/src/stories/components/Communication/Banner.stories.js",
    "packages/styles/src/stories/components/Communication/Modal.stories.js",
    "packages/styles/src/stories/components/Communication/ProcessList.stories.js",
    "packages/styles/src/stories/components/Communication/SiteAlert.stories.js",
    "packages/styles/src/stories/components/Communication/StepIndicator.stories.js",
    "packages/styles/src/stories/components/Communication/SummaryBox.stories.js",
    "handoffs/implement/008-implement-001/S06-documentation-01/results/"
  ],
  "context_gaps": [],
  "validation_commands": [
    "for f in Accordion Alert Banner Modal ProcessList SiteAlert StepIndicator SummaryBox; do test -f \"packages/styles/src/stories/components/Communication/${f}.stories.js\" && echo \"${f}_OK\"; done",
    "grep -q 'USWDS JavaScript' packages/styles/src/stories/components/Communication/Accordion.stories.js",
    "grep -q 'USWDS JavaScript' packages/styles/src/stories/components/Communication/Modal.stories.js"
  ],
  "task_status_update": {
    "mode": "receipt",
    "receipt_path": "handoffs/implement/008-implement-001/S06-documentation-01/results/receipt.json",
    "committer": "core_agent",
    "contract_type": "speckit.implement.receipt.v1",
    "required_fields": ["contract_type", "shard_id", "task_ids", "completed_task_ids", "changed_paths", "validation_evidence"]
  },
  "forbidden_actions": ["edit tasks.md", "edit SCSS source files", "edit .storybook/ config files", "dispatch workers"]
}