{
  "contract_type": "speckit.implement.handoff.v2",
  "shard_id": "S05-integration-05",
  "agent_topology": {
    "core_agent": { "role": "orchestrator" },
    "vertical_planner_agent": { "role": "planner", "vertical_planner_only": true, "may_execute_implementation": false, "may_write_manifest": false, "may_update_tasks_md": false },
    "worker_agent": { "role": "executor", "single_handoff_only": true, "may_dispatch_workers": false, "may_update_tasks_md": false }
  },
  "lifecycle_stage": "documentation",
  "vertical_capability": "integration",
  "capability_boundary": {
    "owns": [
      "packages/styles/src/_uswds-theme.scss"
    ],
    "depends_on": ["S02-integration-02"],
    "must_not_touch": [
      "packages/styles/src/_colors.scss",
      "packages/styles/src/_semantic.scss",
      "packages/styles/src/index.scss",
      "packages/styles/package.json",
      "packages/styles/README.md",
      "packages/styles/BRAND_RULES.md",
      "packages/styles/AGENTS.md"
    ]
  },
  "planner_outputs": {
    "shard_plan_path": "handoffs/implement/run-003/planner-outputs/planner-integration-01/shard-plan.md",
    "handoff_draft_path": "handoffs/implement/run-003/planner-outputs/planner-integration-01/handoff-draft.json",
    "context_digest_draft_path": "handoffs/implement/run-003/planner-outputs/planner-integration-01/context-digest-draft.md",
    "vertical_capability": "integration"
  },
  "draft_source": {
    "vertical_planner_id": "planner-integration-01",
    "handoff_draft_path": "handoffs/implement/run-003/planner-outputs/planner-integration-01/handoff-draft.json",
    "context_digest_draft_path": "handoffs/implement/run-003/planner-outputs/planner-integration-01/context-digest-draft.md"
  },
  "task_ids": ["T036", "T037", "T038"],
  "task_type": "implementation",
  "task_text": [
    "T036: Create documentation comments in _uswds-theme.scss that explain each theme family mapping (which brand color maps to which family and grade)",
    "T037: Add a comment block at the top of _uswds-theme.scss with upgrade instructions: \"To upgrade USWDS: bump version in package.json, rebuild, verify no unexpected color changes. Only this file needs review.\"",
    "T038: Verify FR-008 compliance — confirm that ALL USWDS theme color overrides are scoped exclusively within _uswds-theme.scss and no overrides exist in any other file"
  ],
  "context_digest_path": "handoffs/implement/run-003/S05-integration-05/context-digest.md",
  "context_index_path": "specs/003-wrap-uswds-theme/context-index.json",
  "allowed_read_paths": [
    "packages/styles/src/_uswds-theme.scss",
    "packages/styles/src/_colors.scss",
    "packages/styles/src/_semantic.scss",
    "packages/styles/src/",
    "specs/003-wrap-uswds-theme/research.md",
    "specs/003-wrap-uswds-theme/context-index.json"
  ],
  "allowed_write_paths": [
    "packages/styles/src/_uswds-theme.scss"
  ],
  "context_gaps": [],
  "validation_commands": [
    "test -f packages/styles/src/_uswds-theme.scss && echo 'FILE_EXISTS'",
    "grep -c 'theme-color' packages/styles/src/_uswds-theme.scss | xargs echo 'theme-color-entries:'",
    "cd packages/styles && pnpm build 2>&1 && echo 'BUILD_OK'"
  ],
  "task_status_update": {
    "mode": "receipt",
    "receipt_path": "handoffs/implement/run-003/S05-integration-05/results/receipt.json",
    "committer": "core_agent",
    "contract_type": "speckit.implement.receipt.v1",
    "required_fields": ["contract_type", "shard_id", "task_type", "task_ids", "completed_task_ids", "changed_paths", "validation_evidence"]
  },
  "forbidden_actions": [
    "edit tasks.md",
    "edit _colors.scss",
    "edit _semantic.scss",
    "edit index.scss",
    "edit package.json",
    "edit README.md",
    "edit BRAND_RULES.md",
    "edit AGENTS.md",
    "dispatch workers"
  ]
}